name,address,province,city,area,telephone,tag
W街区工作室(吉大店),广东省珠海市香洲区吉大街道海滨南路9号荣正力邦LOFT文创园a栋6楼6026号（GI时代广场，音乐匣子KTV附近）,广东省,珠海市,香洲区,19820514308,运动健身;其他
灵子舞蹈全国连锁(香洲百货店),广东省珠海市香洲区凤凰南路香洲百货3楼,广东省,珠海市,香洲区,,运动健身;其他
优学季(AHA亚哈启圆横琴金源国际广场店),广东省珠海市香洲区新香江路88号金源国际广场1栋三楼,广东省,珠海市,香洲区,"13570665597,13612235995",运动健身;其他
高师芭蕾文化传播中心,广东省珠海市香洲区前河西路333号8栋负一楼03铺,广东省,珠海市,香洲区,15918778554,教育培训;培训机构
官官舞蹈俱乐部,广东省珠海市斗门区白藤二路新俊湖苑西侧约110米,广东省,珠海市,斗门区,13427789146,运动健身;其他
朱朱舞蹈坊,广东省珠海市斗门区虹桥三路时代倾城三期G-11区41号商铺,广东省,珠海市,斗门区,13160661715,教育培训;培训机构
轻舞飞扬舞蹈培训中心(敬业路店),广东省珠海市香洲区敬业路146-1号,广东省,珠海市,香洲区,(0756)8613367,教育培训;培训机构
清影舞蹈工作室(前山店),广东省珠海市香洲区翠微西路779号（艺术高中公交站）,广东省,珠海市,香洲区,13360610086,教育培训;培训机构
水灵子舞蹈培训机构(井岸分校),广东省珠海市香洲区中兴中路243号井岸大厦二楼（大信新都汇斜对面）,广东省,珠海市,斗门区,15220902095,教育培训;培训机构
娜飞舞蹈,广东省珠海市香洲区拱北粤海中路2610号商铺,广东省,珠海市,香洲区,13620478318,教育培训;培训机构
一橙舞蹈艺术中心(世荣作品壹号店),广东省珠海市斗门区X583(珠峰大道),广东省,珠海市,斗门区,13532280550,教育培训;培训机构
杰出舞蹈(人民东路),广东省珠海市香洲区人民东路372号2楼,广东省,珠海市,香洲区,(0756)2265992,教育培训;培训机构
雅歌舞蹈艺术学校,广东省珠海市香洲区白莲路184号立体科技大厦F1 ,广东省,珠海市,香洲区,(0756)3377797,教育培训;培训机构
琴之韵舞蹈,广东省珠海市香洲区南福路114-3号,广东省,珠海市,香洲区,13622969592,教育培训;培训机构
米乐舞蹈艺术中心,广东省珠海市香洲区翠前北路一街133号苹果派1层,广东省,珠海市,香洲区,18923379743,教育培训;培训机构
佳美舞蹈艺术培训中心,广东省珠海市香洲区紫荆路106-130号南夏广场2层,广东省,珠海市,香洲区,13536553257,教育培训;培训机构
花漾舞蹈艺术中心,广东省珠海市斗门区尖峰前路330号3层,广东省,珠海市,斗门区,(0756)5552121,教育培训;培训机构
塔比鸭舞蹈中心,珠海市斗门区新青五路南碧水岸西南侧约30米,广东省,珠海市,斗门区,15007561976,教育培训;培训机构
妍舞舞蹈工作室,珠海市香洲区创业路御景国际,广东省,珠海市,香洲区,,教育培训;培训机构
尚舞堂舞蹈艺术培训中心,广东省珠海市香洲区翠珠路1号晴川商厦F2 ,广东省,珠海市,香洲区,(0756)8996265,教育培训;培训机构
新星中英文艺术幼儿园新星舞蹈团(粤海西路),广东省珠海市香洲区粤海西路17号明珠山庄小区,广东省,珠海市,香洲区,(0756)8525829,教育培训;其他
清扬舞蹈,广东省珠海市香洲区白云路1号（造贝小学东南门对面）,广东省,珠海市,香洲区,15919161161,教育培训;培训机构
红河谷舞蹈艺术中心,广东省珠海市香洲区梅华西路2100号绿怡居小区78栋,广东省,珠海市,香洲区,,教育培训;培训机构
艺阳舞蹈,广东省珠海市斗门区朝江路30号美澳园3区1号,广东省,珠海市,斗门区,(0756)5311777,教育培训;培训机构
世纪舞者芭蕾舞蹈培训中心,广东省珠海市香洲区金山二巷7号左右创意园2栋1楼25号,广东省,珠海市,香洲区,13411564973,教育培训;培训机构
A+艺多艺术中心,广东省珠海市斗门区金坑中路19号东盛百货楼2层,广东省,珠海市,斗门区,(0756)5508066,教育培训;培训机构
水韵舞蹈艺术培训中心,珠海市斗门区安江路莲溪中学东南侧约60米,广东省,珠海市,斗门区,,教育培训;培训机构
艺潼舞蹈,广东省珠海市香洲区工北街界涌市场,广东省,珠海市,香洲区,13113185526,教育培训;培训机构
艺昇舞蹈培训中心,广东省珠海市斗门区井岸镇井湾路113号三友智创谷B座二楼,广东省,珠海市,斗门区,15977783789,教育培训;培训机构
冰与火舞蹈(珠海红旗分部),广东省珠海市金湾区藤荣路84、86号(澜庭丽舍),广东省,珠海市,金湾区,15307561322,教育培训;培训机构
珠海小百合舞蹈,广东省珠海市香洲区鸿新街69号,广东省,珠海市,香洲区,18933204237,教育培训;培训机构
雨轩舞蹈,广东省珠海市香洲区夏湾路280号春泽名园商铺2层,广东省,珠海市,香洲区,(0756)8888778,教育培训;培训机构
JS流行舞研修中心(井岸旗舰店),广东省珠海市斗门区人民路18号南天百货四楼,广东省,珠海市,斗门区,13286000985,教育培训;培训机构
M33 Dance Studio舞蹈普拉提艺术空间,珠海市香洲区前山路191号(财富世家277号铺1号岗出入口，暨南大学西南门斜对面),广东省,珠海市,香洲区,13726226330,教育培训;培训机构
集美女子塑形健身舞蹈学院,广东省珠海市金湾区金湾华发国际商务中心D区C2004,广东省,珠海市,金湾区,13316665082,教育培训;培训机构
金梦园舞蹈艺术培训中心,广东省珠海市金湾区三灶镇中心村春园路三巷5号首层,广东省,珠海市,金湾区,,教育培训;培训机构
多元艺术钢琴舞蹈教育,珠海市香洲区春晖路春晖市场,广东省,珠海市,香洲区,13322872017,教育培训;培训机构
洋艺舞蹈,珠海市金湾区北河二路易发大厦,广东省,珠海市,金湾区,,教育培训;培训机构
蕾韵舞蹈艺术中心(万科城店),广东省珠海市香洲区云峰路188号万科城商业街（靠云峰小学）,广东省,珠海市,香洲区,15018306090,教育培训;培训机构
培美舞蹈,广东省珠海市斗门区江湾四路44号210室,广东省,珠海市,斗门区,13138105096,教育培训;培训机构
舞蹈培训,珠海市香洲区银海路唐家人才公寓,广东省,珠海市,香洲区,,教育培训;培训机构
启雅舞蹈,珠海市香洲区南湾北路V12文化创意产业园5厂房第2层,广东省,珠海市,香洲区,13510536141,教育培训;培训机构
弥斯舞蹈艺术培训,广东省珠海市香洲区九洲大道西1059号,广东省,珠海市,香洲区,13823059755,教育培训;培训机构
微笑天使芭蕾舞蹈,广东省珠海市香洲区吉大石花西路203号2单元4楼431室,广东省,珠海市,香洲区,13928075850,教育培训;培训机构
芯舞艺舞蹈,广东省珠海市香洲区安富街广富市场二楼3a号,广东省,珠海市,香洲区,13823032029,教育培训;培训机构
唱歌跳舞开课啦,珠海市香洲区香溪路吉宁山庄,广东省,珠海市,香洲区,13016382293,教育培训;培训机构
范范舞蹈艺术培训中心,广东省珠海市香洲区凤凰北路1015号丹田广场4楼08室,广东省,珠海市,香洲区,13326699368,教育培训;培训机构
小公主舞蹈艺术中心(夏湾店),广东省珠海市香洲区港昌路119号中铁大厦1楼,广东省,珠海市,香洲区,13631264056,教育培训;培训机构
K.LDANCE自助舞蹈室,广东省珠海市香洲区左右创意园2栋1楼35-2号商铺,广东省,珠海市,香洲区,17507561324,教育培训;培训机构
红河谷舞蹈艺术中心,广东省珠海市香洲区九洲大道中1038号1楼,广东省,珠海市,香洲区,15818962258,教育培训;培训机构
小白桦舞蹈,广东省珠海市香洲区兴业路97号3楼,广东省,珠海市,香洲区,,
王雪明星舞蹈艺术中心(夏湾校区),广东省珠海市香洲区夏湾路199号朝阳花园2楼,广东省,珠海市,香洲区,13825647722,教育培训;培训机构
街舞培训,广东省珠海市香洲区南厦商业步行街144号,广东省,珠海市,香洲区,,教育培训;培训机构
思傲舞蹈,广东省珠海市斗门区白藤二路112号康裕花园2栋27号,广东省,珠海市,斗门区,"(0756)6983301,18675610175",教育培训;培训机构
JS舞蹈培训,兴门路南门中央广场二楼,广东省,珠海市,斗门区,15155898333,教育培训;培训机构
新能量街舞培训基地,广东省珠海市斗门区里维埃拉商业街二楼206号,广东省,珠海市,斗门区,18218338605,教育培训;培训机构
微舞生活空间·街舞·模特·声乐·影视表演,广东省珠海市香洲区迎宾南路1144号,广东省,珠海市,香洲区,,教育培训
C X·创星舞蹈(米兰百货广场店),珠海市香洲区迎宾南路1099号米兰百货广场二楼B015室,广东省,珠海市,香洲区,13113431343,教育培训;培训机构
TZ舞蹈(金鼎分校),广东省珠海市香洲区上栅南街58号2楼,广东省,珠海市,香洲区,13226027236,教育培训;培训机构
牧歌舞蹈艺术中心,广东省珠海市金湾区博萃街航空新城3-18号,广东省,珠海市,金湾区,"13631293099,16626232406",教育培训;培训机构
魏鑫艺术艺茜舞蹈培训中心(平沙店),珠海市金湾区美平二街时代港,广东省,珠海市,金湾区,18138687220,教育培训;培训机构
舞蹈培训公司,珠海市香洲区关闸北街金域酒店东南侧,广东省,珠海市,香洲区,,教育培训;培训机构
超颖舞蹈艺术中心,广东省珠海市斗门区14巷1号,广东省,珠海市,斗门区,13425039872,教育培训;培训机构
艺哚舞蹈,珠海市香洲区教育路珠海市香洲区造贝学校西北侧约40米,广东省,珠海市,香洲区,15818998051,教育培训;培训机构
艺特皇家教育城(春晖校区),广东省珠海市香洲区春晖路105号3楼,广东省,珠海市,香洲区,,教育培训;培训机构
佳音艺术培训中心,广东省珠海市金湾区美平二街时代港1楼147号,广东省,珠海市,金湾区,15323612597,教育培训;培训机构
N2扭兔街舞工作室,广东省珠海市香洲区梅界路珠海奥园商业广场SY4-2105,广东省,珠海市,香洲区,,教育培训;培训机构
